[
  {
    "id": "20260623T100000Z-over-ear-noise-cancelling-headphones-for",
    "timestamp": "2026-06-23T10:00:00.000Z",
    "need": "Over-ear noise-cancelling headphones for travel and focus",
    "category_taxonomy": "electronics/audio/headphones/over-ear-anc",
    "beneficiary_type": "self",
    "outcome": "RECOMMEND",
    "reason_code": "NONE",
    "pick": "Sony WH-1000XM5",
    "confidence_overall": 0.82,
    "json": "runs/20260623T100000Z-over-ear-noise-cancelling-headphones-for.json",
    "md": "runs/20260623T100000Z-over-ear-noise-cancelling-headphones-for.md"
  }
]